Title,$Price
Check Cotton Shorts,760.00
EKD Monogram Silk Shorts,1050.00
EKD Technical Cotton Piqué Shorts,480.00
Ice Cream Print Silk Shorts,1050.00
EKD Silk Shorts,1050.00
Check Mesh Shorts,680.00
Logo Print Cotton Shorts,590.00
Check Silk Wool Jacquard Shorts,720.00
Monogram Motif Stonewashed Denim Jeans,920.00
Straight Fit Polka Dot Stonewash Jeans,920.00
Cotton Cargo Trousers,720.00
Nylon Cargo Trousers,760.00
Cotton Cargo Trousers,720.00
Logo Print Stretch Nylon Trousers,820.00
Monogram Motif Stretch Cotton Twill Chinos,550.00
Monogram Motif Stretch Cotton Twill Chinos,550.00
Prorsum Label Cotton Jogging Pants,760.00
Prorsum Label Cotton Jogging Pants,760.00
Prorsum Label Cotton Jogging Pants,760.00
Check Panel Cotton Blend Jogging Pants,820.00
